{
  "$schema": "http://json-schema.org/draft-07/schema#",
  "$comment": "GENERATED by gui/schema-gen/derive_nf_config_schemas.py from config/upf.json + its source (ADR-0425). Do not edit; regenerate.",
  "title": "upf",
  "type": "object",
  "additionalProperties": false,
  "properties": {
    "port": {
      "type": "integer",
      "x-cpp-type": "unsigned short"
    },
    "pfcp_bind_port": {
      "type": "integer",
      "x-env-override": "UPF_PFCP_BIND_PORT",
      "x-cpp-type": "std::uint16_t"
    },
    "pfcp_bind_address": {
      "type": "string",
      "x-env-override": "UPF_PFCP_BIND_ADDRESS",
      "x-cpp-type": "std::string"
    },
    "sbi_bind_address": {
      "type": "string",
      "x-cpp-type": "std::string"
    },
    "metrics_bind_address": {
      "type": "string",
      "x-cpp-type": "std::string"
    },
    "nrf_base_url": {
      "type": "string",
      "x-env-override": "UPF_NRF_BASE_URL",
      "x-cpp-type": "std::string"
    },
    "advertised_ipv4": {
      "type": "string",
      "x-env-override": "UPF_ADVERTISED_IPV4",
      "x-cpp-type": "std::string"
    },
    "li_poi": {
      "type": "object",
      "additionalProperties": false,
      "properties": {
        "enabled": {
          "type": "boolean"
        },
        "x1_bind_address": {
          "type": "string"
        },
        "x1_port": {
          "type": "integer"
        },
        "ne_identifier": {
          "type": "string"
        },
        "network_function_id": {
          "type": "string"
        },
        "interception_point_id": {
          "type": "string"
        },
        "mdf3_host": {
          "type": "string"
        },
        "mdf3_port": {
          "type": "integer"
        },
        "mdf3_sni": {
          "type": "string"
        },
        "x1_keepalive_p1_seconds": {
          "type": "integer"
        },
        "x1_keepalive_p2_seconds": {
          "type": "integer"
        },
        "x1_keepalive_p3_seconds": {
          "type": "integer"
        },
        "x1_allow_deactivate_all": {
          "type": "boolean"
        }
      }
    },
    "oauth2_required": {
      "type": "boolean",
      "x-env-override": "UPF_OAUTH2_REQUIRED",
      "x-cpp-type": "bool"
    }
  },
  "required": [
    "advertised_ipv4",
    "metrics_bind_address",
    "nrf_base_url",
    "pfcp_bind_address",
    "pfcp_bind_port",
    "port",
    "sbi_bind_address"
  ],
  "x-config-file": "config/upf.json",
  "x-source": [
    "nfs/upf"
  ],
  "x-apply": "restart",
  "x-review": [
    "li_poi: nested object shape inferred from current values (map-vs-struct meaning unverified; new keys refused until reviewed)"
  ]
}
